{
    "schema_version": "2020-12",
    "outcome_id": "OUT_SYN_OUT_008",
    "encounter_id": "SYN_OUT_008",
    "primary_assessment": "Đái tháo đường type 2 không có biến chứng",
    "secondary_assessments": [],
    "recommended_action": "Theo dõi và điều trị",
    "follow_up_required": true,
    "follow_up_timeframe": "30",
    "red_flags_to_watch": [
        {
            "red_flag_text": "Hạ đường huyết (mệt lả, đổ mồ hôi, bủn rủn)",
            "review_status": "pending_review"
        },
        {
            "red_flag_text": "Đường huyết lúc đói > 10 mmol/L",
            "review_status": "pending_review"
        }
    ],
    "disposition": "outpatient_follow_up",
    "source_segment_ids": [
        "seg_002",
        "seg_004",
        "seg_006",
        "seg_007"
    ],
    "doctor_confirmation_status": "pending",
    "review_status": "pending_review",
    "safety_critical": false,
    "created_at": "2026-06-03T00:00:00+07:00",
    "created_by": "Duy",
    "version": "v0.1.0"
}